{
  "$schema": "./capability-contracts.schema.json",
  "contractProfile": "contract_v1",
  "schemaVersion": 3,
  "protocolVersion": 2,
  "runtimeFloor": 2,
  "packageLimits": {
    "archiveBytes": 26214400,
    "extractedBytes": 52428800,
    "files": 1000,
    "iconBytes": 1048576
  },
  "errors": [
    "permission_denied",
    "capability_unavailable",
    "invalid_request",
    "origin_denied",
    "network_timeout",
    "request_timeout",
    "http_error",
    "quota_exceeded",
    "resource_too_large",
    "migration_failed",
    "user_cancelled",
    "foreground_required",
    "idempotency_conflict",
    "lease_not_found",
    "foreground_service_denied",
    "notifications_unavailable"
  ],
  "marketplaceCategories": [
    "academic",
    "campus",
    "information",
    "productivity",
    "assistant",
    "other"
  ],
  "configurationTypes": [
    "text",
    "secret",
    "url",
    "number",
    "boolean",
    "select"
  ],
  "schemas": {
    "empty": {
      "type": "object",
      "additionalProperties": false
    },
    "readOptions": {
      "type": "object",
      "additionalProperties": false,
      "properties": {
        "forceRefresh": {
          "type": "boolean"
        }
      }
    },
    "campusReadMeta": {
      "type": "object",
      "additionalProperties": false,
      "required": [
        "syncedAt",
        "source",
        "coverage",
        "fromCache"
      ],
      "properties": {
        "syncedAt": {
          "type": "string"
        },
        "source": {
          "type": "string",
          "enum": [
            "cache",
            "network",
            "mixed"
          ]
        },
        "coverage": {
          "type": "string",
          "enum": [
            "complete",
            "partial",
            "unknown"
          ]
        },
        "fromCache": {
          "type": "boolean"
        }
      }
    },
    "campusRead": {
      "type": "object",
      "additionalProperties": false,
      "required": [
        "data",
        "meta"
      ],
      "properties": {
        "data": {},
        "meta": {
          "$ref": "#/schemas/campusReadMeta"
        }
      }
    },
    "studentProfileRead": {
      "type": "object",
      "additionalProperties": false,
      "required": [
        "data",
        "meta"
      ],
      "properties": {
        "data": {
          "type": "object",
          "additionalProperties": false,
          "required": [
            "fields",
            "sections"
          ],
          "properties": {
            "name": { "type": "string" },
            "studentId": { "type": "string" },
            "account": { "type": "string" },
            "gender": { "type": "string" },
            "birthday": { "type": "string" },
            "college": { "type": "string" },
            "major": { "type": "string" },
            "className": { "type": "string" },
            "grade": { "type": "string" },
            "educationLevel": { "type": "string" },
            "studentStatus": { "type": "string" },
            "campus": { "type": "string" },
            "phone": { "type": "string" },
            "email": { "type": "string" },
            "avatarUrl": { "type": "string" },
            "fields": {
              "type": "array",
              "items": { "type": "object" }
            },
            "sections": {
              "type": "array",
              "items": { "type": "object" }
            }
          }
        },
        "meta": { "$ref": "#/schemas/campusReadMeta" }
      }
    },
    "timetableRead": {
      "type": "object",
      "additionalProperties": false,
      "required": ["data", "meta"],
      "properties": {
        "data": {
          "type": "object",
          "additionalProperties": false,
          "required": ["days", "periods", "entries", "availableTerms"],
          "properties": {
            "days": { "type": "array", "items": { "type": "string" } },
            "periods": { "type": "array", "items": { "type": "string" } },
            "entries": { "type": "array", "items": { "type": "object" } },
            "currentTerm": { "type": "string" },
            "availableTerms": { "type": "array", "items": { "type": "object" } }
          }
        },
        "meta": { "$ref": "#/schemas/campusReadMeta" }
      }
    },
    "scoreRead": {
      "type": "object",
      "additionalProperties": false,
      "required": ["data", "meta"],
      "properties": {
        "data": {
          "type": "object",
          "additionalProperties": false,
          "required": ["availableTerms", "items"],
          "properties": {
            "currentTerm": { "type": "string" },
            "availableTerms": { "type": "array", "items": { "type": "object" } },
            "items": { "type": "array", "items": { "type": "object" } }
          }
        },
        "meta": { "$ref": "#/schemas/campusReadMeta" }
      }
    },
    "examRead": {
      "type": "object",
      "additionalProperties": false,
      "required": ["data", "meta"],
      "properties": {
        "data": {
          "type": "object",
          "additionalProperties": false,
          "required": ["availableTerms", "items"],
          "properties": {
            "currentTerm": { "type": "string" },
            "availableTerms": { "type": "array", "items": { "type": "object" } },
            "items": { "type": "array", "items": { "type": "object" } }
          }
        },
        "meta": { "$ref": "#/schemas/campusReadMeta" }
      }
    },
    "calendarRead": {
      "type": "object",
      "additionalProperties": false,
      "required": ["data", "meta"],
      "properties": {
        "data": {
          "type": "object",
          "additionalProperties": false,
          "required": ["month", "availableTerms", "items"],
          "properties": {
            "month": { "type": "string" },
            "currentWeek": { "type": "string" },
            "currentTerm": { "type": "string" },
            "availableTerms": { "type": "array", "items": { "type": "object" } },
            "items": { "type": "array", "items": { "type": "object" } }
          }
        },
        "meta": { "$ref": "#/schemas/campusReadMeta" }
      }
    },
    "academicProgressRead": {
      "type": "object",
      "additionalProperties": false,
      "required": ["data", "meta"],
      "properties": {
        "data": {
          "type": "object",
          "additionalProperties": false,
          "required": [
            "summary",
            "buckets",
            "mergedBuckets",
            "detailBuckets",
            "courses",
            "replaceCourses",
            "fields"
          ],
          "properties": {
            "currentTerm": { "type": "string" },
            "summary": { "type": "object" },
            "buckets": { "type": "array", "items": { "type": "object" } },
            "mergedBuckets": { "type": "array", "items": { "type": "object" } },
            "detailBuckets": { "type": "array", "items": { "type": "object" } },
            "courses": { "type": "array", "items": { "type": "object" } },
            "replaceCourses": { "type": "array", "items": { "type": "object" } },
            "fields": { "type": "array", "items": { "type": "object" } }
          }
        },
        "meta": { "$ref": "#/schemas/campusReadMeta" }
      }
    },
    "homeworkRead": {
      "type": "object",
      "additionalProperties": false,
      "required": ["data", "meta"],
      "properties": {
        "data": {
          "type": "object",
          "additionalProperties": false,
          "required": ["courses", "items"],
          "properties": {
            "currentTerm": { "type": "string" },
            "courses": { "type": "array", "items": { "type": "object" } },
            "items": { "type": "array", "items": { "type": "object" } }
          }
        },
        "meta": { "$ref": "#/schemas/campusReadMeta" }
      }
    },
    "courseResourcesRead": {
      "type": "object",
      "additionalProperties": false,
      "required": ["data", "meta"],
      "properties": {
        "data": {
          "type": "object",
          "additionalProperties": false,
          "required": [
            "courses",
            "folderId",
            "categories",
            "selectedCategoryKey",
            "tree",
            "folders",
            "resources"
          ],
          "properties": {
            "currentTerm": { "type": "string" },
            "courses": { "type": "array", "items": { "type": "object" } },
            "selectedCourseId": { "type": "integer" },
            "folderId": { "type": "string" },
            "categories": { "type": "array", "items": { "type": "object" } },
            "selectedCategoryKey": { "type": "string" },
            "tree": { "type": "array", "items": { "type": "object" } },
            "folders": { "type": "array", "items": { "type": "object" } },
            "resources": { "type": "array", "items": { "type": "object" } }
          }
        },
        "meta": { "$ref": "#/schemas/campusReadMeta" }
      }
    },
    "mailFoldersRead": {
      "type": "object",
      "additionalProperties": false,
      "required": ["data", "meta"],
      "properties": {
        "data": {
          "type": "object",
          "additionalProperties": false,
          "required": ["folders"],
          "properties": {
            "folders": { "type": "array", "items": { "type": "object" } }
          }
        },
        "meta": { "$ref": "#/schemas/campusReadMeta" }
      }
    },
    "mailMessagesRead": {
      "type": "object",
      "additionalProperties": false,
      "required": ["data", "meta"],
      "properties": {
        "data": {
          "type": "object",
          "additionalProperties": false,
          "required": ["folderId", "start", "limit", "total", "messages"],
          "properties": {
            "folderId": { "type": "string" },
            "start": { "type": "integer" },
            "limit": { "type": "integer" },